{
  "$schema": "https://json-schema.org/draft-07/schema#",
  "$id": "capabilities.schema.json",
  "title": "能力清单 GET /app/capabilities data — v2",
  "description": "Renderer 原则的地基（ADR-0002 Rev-8 / FE-1）：前端/旗舰/应用模板据 businessModules + features 显隐导航与功能，按能力而非 runtime 语言身份分支。preset ∈ {full,small,lite}（EASY-3 三档）；features = 特性开关 key→bool（key 集见 FEATURE_KEYS，随模块增长，故为开放 boolean 映射）；ai 供前端判定「AI 开了但没配模型」。来源：src/app-version/capabilities.service.ts getCapabilities()；src/feature-flags/feature-flags.constants.ts:9-49；src/common/modules/modules-manifest.ts（businessModules = category==='business' 且 feature flag 未关的 {id,label,description} 投影）。 v2 增量：加 display —— 渲染器用的**全局展示参数**，当日只有 currencySymbol。币种此前在三个端各有一个常量（后端 / Web 管理台 / Flutter），规则一致而符号无单一权威；v2 让服务端成为那个权威。为什么走 v2 而不是就地加：v1 是 additionalProperties:false，加字段即改形状，须先出 schemas/vN/ 并更新 registry 再改实现（README §Rules）。",
  "type": "object",
  "required": ["preset", "features", "ai", "businessModules", "display"],
  "additionalProperties": false,
  "properties": {
    "preset": { "type": "string", "enum": ["full", "small", "lite"] },
    "features": {
      "type": "object",
      "additionalProperties": { "type": "boolean" }
    },
    "ai": {
      "type": "object",
      "required": ["enabled", "providerConfigured", "provider"],
      "additionalProperties": false,
      "properties": {
        "enabled": { "type": "boolean" },
        "providerConfigured": { "type": "boolean" },
        "provider": { "type": "string" }
      }
    },
    "businessModules": {
      "type": "array",
      "items": {
        "type": "object",
        "required": ["id", "label", "description"],
        "additionalProperties": false,
        "properties": {
          "id": { "type": "string" },
          "label": { "type": "string" },
          "description": { "type": "string" }
        }
      }
    },
    "display": {
      "type": "object",
      "description": "渲染器用的全局展示参数。当日只有币种符号；它取代了三个端各自的常量，使金额显示有单一权威。",
      "required": ["currencySymbol"],
      "additionalProperties": false,
      "properties": {
        "currencySymbol": {
          "type": "string",
          "minLength": 1,
          "description": "金额显示用的币种符号（如 ¥、$）。前端把它交给各端的 money 工具（三端工具均接受 symbol 覆盖参数）。"
        }
      }
    }
  }
}
